{
  "args": {
    "content": {
      "$redacted": {
        "length": 31,
        "reason": "private_content",
        "token": "r-2",
        "value_type": "string"
      }
    },
    "path": "$workspace/secret.txt"
  },
  "capability": "fs.write",
  "kind": "tool_call_started",
  "metadata": {
    "policy_ref": "p-1"
  },
  "redacted_fields": [
    "/args/content"
  ],
  "run_id": "0123456789abcdef0123456789abcdef",
  "sequence": 3,
  "stage_id": "Write",
  "stage_visit_id": "s-1",
  "timestamp": "2026-01-02T03:04:05.002Z",
  "tool_call_id": "t-1",
  "tool_name": "writer"
}
